{
	"$schema": "https://json-schema.org/draft/2020-12/schema",
	"$id": "https://raw.githubusercontent.com/jczhang02/pi-stuff/main/schemas/suite.schema.json",
	"title": "Pi Stuff Suite registry",
	"type": "object",
	"additionalProperties": false,
	"required": ["schemaVersion", "capabilities", "tools"],
	"properties": {
		"$schema": {
			"type": "string"
		},
		"schemaVersion": {
			"const": 2
		},
		"capabilities": {
			"type": "array",
			"items": {
				"enum": [
					"conversation-ui",
					"fast-resume",
					"session-naming",
					"tool-display",
					"rtk",
					"codex",
					"goal",
					"context-management",
					"ponytail",
					"web",
					"mcp",
					"background-work",
					"subagents",
					"todo",
					"btw",
					"notification",
					"code-mode"
				]
			},
			"uniqueItems": true
		},
		"tools": {
			"type": "array",
			"items": {
				"type": "string",
				"minLength": 1
			},
			"uniqueItems": true
		},
		"deferredTools": {
			"type": "array",
			"description": "Suite-owned Tools that must declare Activity metadata but may register after session_start.",
			"items": {
				"type": "string",
				"minLength": 1
			},
			"uniqueItems": true
		},
		"optionalTools": {
			"type": "array",
			"items": {
				"type": "string",
				"minLength": 1
			},
			"uniqueItems": true
		}
	}
}
