{
	"$schema": "../../schemas/suite.schema.json",
	"schemaVersion": 2,
	"capabilities": [
		"conversation-ui",
		"fast-resume",
		"session-naming",
		"tool-display",
		"rtk",
		"codex",
		"goal",
		"context-management",
		"ponytail",
		"web",
		"mcp",
		"background-work",
		"subagents",
		"todo",
		"btw",
		"notification",
		"code-mode"
	],
	"tools": [
		"read",
		"write",
		"edit",
		"grep",
		"find",
		"ls",
		"bash",
		"apply_patch",
		"view_image",
		"imagegen",
		"goal_complete",
		"goal_blocked",
		"web_search",
		"fetch_content",
		"get_search_content",
		"mcp",
		"background",
		"monitor",
		"subagent",
		"TaskCreate",
		"TaskGet",
		"TaskList",
		"TaskUpdate"
	],
	"deferredTools": ["ctx_expand", "ctx_search", "ctx_memory", "ctx_note", "ctx_reduce"],
	"optionalTools": ["subagent_supervisor", "intercom", "contact_supervisor", "structured_output"]
}
